{
  "affected_contracts": [
    "DERIVED_REGISTRY_PROJECTION"
  ],
  "authority_change": false,
  "change_summary": "Regenerate the derived registry from the unchanged source.",
  "implementation_reference": "demo:deterministic-regeneration",
  "migration_required": false,
  "parent_revision": "source-revision-0001",
  "rollback_reference": "D19-ER1-DEMO-001-ROLLBACK",
  "security_change": false,
  "semantic_change": false,
  "target_component": "DEMO_DERIVED_TASK_REGISTRY",
  "target_repository": "joy7758/digital-biosphere-architecture-specification",
  "test_reference": "EV-T23",
  "variant_id": "D19-ER1-DEMO-001-V1",
  "variant_kind": "MINIMAL_REPAIR"
}
